{
  "constraints": [
    "Do not alter promoted Behavior or Look geometry."
  ],
  "id": "idea-scar-tissue-chromatic-v1",
  "questions": [
    "Which simulation values should colour communicate?"
  ],
  "raw_text": "Use colour to expose memory-field state while preserving the promoted Behavior and structural Look.",
  "schema_version": 1,
  "state": "proposed",
  "title": "Scar Tissue semantic chromatic system",
  "track": "chromatic",
  "visibility": "private"
}
