{
  "id": "idea-scar-tissue-cinematography-abc-a-v1",
  "raw_text": "Interpret the system at holistic, environmental, and intimate scales, then return to the establishing view.",
  "schema_version": 1,
  "state": "archived",
  "title": "Scar Tissue A-B-C-A cinematography",
  "track": "cinematography",
  "visibility": "private"
}
