{

  "schema_version": 1,
  "id": "idea-scar-tissue",
  "title": "Scar Tissue",
  "raw_text": "Currents deposit a persistent oriented field that attracts following agents until saturation makes it inhibitory; abandoned paths decay and become traversable again.",
  "track": "behavior",
  "state": "scoped",
  "visibility": "private",
  "source_urls": [],
  "questions": [
    "Can one local memory rule produce reinforcement, congestion, abandonment, and regrowth?",
    "Does oriented memory make path formation legible without a polished look?"
  ],
  "constraints": ["cheap instrument output", "deterministic seed", "no specimen look or cinematic camera"]
}
