{
  "id": "idea-8368a08c4dc5",
  "raw_text": "Develop three independent visual languages for the promoted Scar Tissue directional-refractory behavior without changing its mechanics, palette semantics, or camera.",
  "schema_version": 1,
  "state": "archived",
  "title": "Develop three independent visual languages for the promoted Scar Tissue directional-refractory behavior without changing",
  "track": "look",
  "visibility": "private"
}
